<?xml version="1.0" encoding="UTF-8"?>
<prices xmlns="http://www.example.org/pricing" xmlns:xsi="http://www.w3.org/2001/XMLSchema-instance" 
        xsi:schemaLocation="http://www.example.org/pricing http://192.168.1.11:8080/totalPrice/pricing.xsd">
          <price><qty>5</qty><price>5.0</price></price>
  <price><qty>5</qty><price>5.0</price></price>
  <price><qty>5</qty><price>5.0</price></price>
  <price><qty>5</qty><price>5.0</price></price>
  <price><qty>5</qty><price>5.0</price></price>
  <price><qty>5</qty><price>5.0</price></price>
  <price><qty>5</qty><price>5.0</price></price>
  <price><qty>5</qty><price>5.0</price></price>
  <price><qty>5</qty><price>5.0</price></price>
  <price><qty>5</qty><price>5.0</price></price>
  <price><qty>5</qty><price>5.0</price></price>
  <price><qty>5</qty><price>5.0</price></price>
  <price><qty>5</qty><price>5.0</price></price>
  <price><qty>5</qty><price>5.0</price></price>
  <price><qty>5</qty><price>5.0</price></price>
  <price><qty>5</qty><price>5.0</price></price>
  <price><qty>5</qty><price>5.0</price></price>
  <price><qty>5</qty><price>5.0</price></price>
  <price><qty>5</qty><price>5.0</price></price>
  <price><qty>5</qty><price>5.0</price></price>
  <price><qty>5</qty><price>5.0</price></price>
  <price><qty>5</qty><price>5.0</price></price>
  <price><qty>5</qty><price>5.0</price></price>
  <price><qty>5</qty><price>5.0</price></price>
  <price><qty>5</qty><price>5.0</price></price>
  <price><qty>5</qty><price>5.0</price></price>
  <price><qty>5</qty><price>5.0</price></price>
  <price><qty>5</qty><price>5.0</price></price>
  <price><qty>5</qty><price>5.0</price></price>
  <price><qty>5</qty><price>5.0</price></price>
  <price><qty>5</qty><price>5.0</price></price>
  <price><qty>5</qty><price>5.0</price></price>
  <price><qty>5</qty><price>5.0</price></price>
  <price><qty>5</qty><price>5.0</price></price>
  <price><qty>5</qty><price>5.0</price></price>
  <price><qty>5</qty><price>5.0</price></price>
  <price><qty>5</qty><price>5.0</price></price>
  <price><qty>5</qty><price>5.0</price></price>
  <price><qty>5</qty><price>5.0</price></price>
  <price><qty>5</qty><price>5.0</price></price>
  <price><qty>5</qty><price>5.0</price></price>
  <price><qty>5</qty><price>5.0</price></price>
  <price><qty>5</qty><price>5.0</price></price>
  <price><qty>5</qty><price>5.0</price></price>
  <price><qty>5</qty><price>5.0</price></price>
  <price><qty>5</qty><price>5.0</price></price>
  <price><qty>5</qty><price>5.0</price></price>
  <price><qty>5</qty><price>5.0</price></price>
  <price><qty>5</qty><price>5.0</price></price>
  <price><qty>5</qty><price>5.0</price></price>
  <price><qty>5</qty><price>5.0</price></price>
  <price><qty>5</qty><price>5.0</price></price>
  <price><qty>5</qty><price>5.0</price></price>
  <price><qty>5</qty><price>5.0</price></price>
  <price><qty>5</qty><price>5.0</price></price>
  <price><qty>5</qty><price>5.0</price></price>
  <price><qty>5</qty><price>5.0</price></price>
  <price><qty>5</qty><price>5.0</price></price>
  <price><qty>5</qty><price>5.0</price></price>
  <price><qty>5</qty><price>5.0</price></price>
  <price><qty>5</qty><price>5.0</price></price>
  <price><qty>5</qty><price>5.0</price></price>
  <price><qty>5</qty><price>5.0</price></price>
  <price><qty>5</qty><price>5.0</price></price>
  <price><qty>5</qty><price>5.0</price></price>
  <price><qty>5</qty><price>5.0</price></price>
  <price><qty>5</qty><price>5.0</price></price>
  <price><qty>5</qty><price>5.0</price></price>
  <price><qty>5</qty><price>5.0</price></price>
  <price><qty>5</qty><price>5.0</price></price>
  <price><qty>5</qty><price>5.0</price></price>
  <price><qty>5</qty><price>5.0</price></price>
  <price><qty>5</qty><price>5.0</price></price>
  <price><qty>5</qty><price>5.0</price></price>
  <price><qty>5</qty><price>5.0</price></price>
  <price><qty>5</qty><price>5.0</price></price>
  <price><qty>5</qty><price>5.0</price></price>
  <price><qty>5</qty><price>5.0</price></price>
  <price><qty>5</qty><price>5.0</price></price>
  <price><qty>5</qty><price>5.0</price></price>
  <price><qty>5</qty><price>5.0</price></price>
  <price><qty>5</qty><price>5.0</price></price>
  <price><qty>5</qty><price>5.0</price></price>
  <price><qty>5</qty><price>5.0</price></price>
  <price><qty>5</qty><price>5.0</price></price>
  <price><qty>5</qty><price>5.0</price></price>
  <price><qty>5</qty><price>5.0</price></price>
  <price><qty>5</qty><price>5.0</price></price>
  <price><qty>5</qty><price>5.0</price></price>
  <price><qty>5</qty><price>5.0</price></price>
  <price><qty>5</qty><price>5.0</price></price>
  <price><qty>5</qty><price>5.0</price></price>
  <price><qty>5</qty><price>5.0</price></price>
  <price><qty>5</qty><price>5.0</price></price>
  <price><qty>5</qty><price>5.0</price></price>
  <price><qty>5</qty><price>5.0</price></price>
  <price><qty>5</qty><price>5.0</price></price>
  <price><qty>5</qty><price>5.0</price></price>
  <price><qty>5</qty><price>5.0</price></price>
  <price><qty>5</qty><price>5.0</price></price>
  <price><qty>5</qty><price>5.0</price></price>
  <price><qty>5</qty><price>5.0</price></price>
  <price><qty>5</qty><price>5.0</price></price>
  <price><qty>5</qty><price>5.0</price></price>
  <price><qty>5</qty><price>5.0</price></price>
  <price><qty>5</qty><price>5.0</price></price>
  <price><qty>5</qty><price>5.0</price></price>
  <price><qty>5</qty><price>5.0</price></price>
  <price><qty>5</qty><price>5.0</price></price>
  <price><qty>5</qty><price>5.0</price></price>
  <price><qty>5</qty><price>5.0</price></price>
  <price><qty>5</qty><price>5.0</price></price>
  <price><qty>5</qty><price>5.0</price></price>
  <price><qty>5</qty><price>5.0</price></price>
  <price><qty>5</qty><price>5.0</price></price>
  <price><qty>5</qty><price>5.0</price></price>
  <price><qty>5</qty><price>5.0</price></price>
  <price><qty>5</qty><price>5.0</price></price>
  <price><qty>5</qty><price>5.0</price></price>
  <price><qty>5</qty><price>5.0</price></price>
  <price><qty>5</qty><price>5.0</price></price>
  <price><qty>5</qty><price>5.0</price></price>
  <price><qty>5</qty><price>5.0</price></price>
  <price><qty>5</qty><price>5.0</price></price>
  <price><qty>5</qty><price>5.0</price></price>
  <price><qty>5</qty><price>5.0</price></price>
  <price><qty>5</qty><price>5.0</price></price>
  <price><qty>5</qty><price>5.0</price></price>
  <price><qty>5</qty><price>5.0</price></price>
  <price><qty>5</qty><price>5.0</price></price>
  <price><qty>5</qty><price>5.0</price></price>
  <price><qty>5</qty><price>5.0</price></price>
  <price><qty>5</qty><price>5.0</price></price>
  <price><qty>5</qty><price>5.0</price></price>
  <price><qty>5</qty><price>5.0</price></price>
  <price><qty>5</qty><price>5.0</price></price>
  <price><qty>5</qty><price>5.0</price></price>
  <price><qty>5</qty><price>5.0</price></price>
  <price><qty>5</qty><price>5.0</price></price>
  <price><qty>5</qty><price>5.0</price></price>
  <price><qty>5</qty><price>5.0</price></price>
  <price><qty>5</qty><price>5.0</price></price>
  <price><qty>5</qty><price>5.0</price></price>
  <price><qty>5</qty><price>5.0</price></price>
  <price><qty>5</qty><price>5.0</price></price>
  <price><qty>5</qty><price>5.0</price></price>
  <price><qty>5</qty><price>5.0</price></price>
  <price><qty>5</qty><price>5.0</price></price>
  <price><qty>5</qty><price>5.0</price></price>
  <price><qty>5</qty><price>5.0</price></price>
  <price><qty>5</qty><price>5.0</price></price>
  <price><qty>5</qty><price>5.0</price></price>
  <price><qty>5</qty><price>5.0</price></price>
  <price><qty>5</qty><price>5.0</price></price>
  <price><qty>5</qty><price>5.0</price></price>
  <price><qty>5</qty><price>5.0</price></price>
  <price><qty>5</qty><price>5.0</price></price>
  <price><qty>5</qty><price>5.0</price></price>
  <price><qty>5</qty><price>5.0</price></price>
  <price><qty>5</qty><price>5.0</price></price>
  <price><qty>5</qty><price>5.0</price></price>
  <price><qty>5</qty><price>5.0</price></price>
  <price><qty>5</qty><price>5.0</price></price>
  <price><qty>5</qty><price>5.0</price></price>
  <price><qty>5</qty><price>5.0</price></price>
  <price><qty>5</qty><price>5.0</price></price>
  <price><qty>5</qty><price>5.0</price></price>
  <price><qty>5</qty><price>5.0</price></price>
  <price><qty>5</qty><price>5.0</price></price>
  <price><qty>5</qty><price>5.0</price></price>
  <price><qty>5</qty><price>5.0</price></price>
  <price><qty>5</qty><price>5.0</price></price>
  <price><qty>5</qty><price>5.0</price></price>
  <price><qty>5</qty><price>5.0</price></price>
  <price><qty>5</qty><price>5.0</price></price>
  <price><qty>5</qty><price>5.0</price></price>
  <price><qty>5</qty><price>5.0</price></price>
  <price><qty>5</qty><price>5.0</price></price>
  <price><qty>5</qty><price>5.0</price></price>
  <price><qty>5</qty><price>5.0</price></price>
  <price><qty>5</qty><price>5.0</price></price>
  <price><qty>5</qty><price>5.0</price></price>
  <price><qty>5</qty><price>5.0</price></price>
  <price><qty>5</qty><price>5.0</price></price>
  <price><qty>5</qty><price>5.0</price></price>
  <price><qty>5</qty><price>5.0</price></price>
  <price><qty>5</qty><price>5.0</price></price>
  <price><qty>5</qty><price>5.0</price></price>
  <price><qty>5</qty><price>5.0</price></price>
  <price><qty>5</qty><price>5.0</price></price>
  <price><qty>5</qty><price>5.0</price></price>
  <price><qty>5</qty><price>5.0</price></price>
  <price><qty>5</qty><price>5.0</price></price>
  <price><qty>5</qty><price>5.0</price></price>
  <price><qty>5</qty><price>5.0</price></price>
  <price><qty>5</qty><price>5.0</price></price>
  <price><qty>5</qty><price>5.0</price></price>
  <price><qty>5</qty><price>5.0</price></price>
  <price><qty>5</qty><price>5.0</price></price>
  <price><qty>5</qty><price>5.0</price></price>
  <price><qty>5</qty><price>5.0</price></price>
  <price><qty>5</qty><price>5.0</price></price>